{
  "artifacts": {
    "bugzilla_comment": "submission/bugzilla-comment.txt",
    "mailing_list_cover": "submission/mailing-list-cover.txt",
    "maintainer_summary": "submission/maintainer-summary.md"
  },
  "backports": {
    "gcc-13": {
      "apply_mode": "unknown",
      "backport_candidate": null,
      "branch_commit": null,
      "branch_patch": null,
      "full_suite": "not-run",
      "notes": "",
      "reproduces": null,
      "targeted_tests": "not-run"
    },
    "gcc-14": {
      "apply_mode": "unknown",
      "backport_candidate": null,
      "branch_commit": null,
      "branch_patch": null,
      "full_suite": "not-run",
      "notes": "",
      "reproduces": null,
      "targeted_tests": "not-run"
    },
    "gcc-15": {
      "apply_mode": "unknown",
      "backport_candidate": null,
      "branch_commit": null,
      "branch_patch": null,
      "full_suite": "not-run",
      "notes": "",
      "reproduces": null,
      "targeted_tests": "not-run"
    }
  },
  "bugzilla": {
    "id": 84245,
    "keywords": [
      "error-recovery",
      "ice-on-invalid-code"
    ],
    "refreshed_at": "2026-03-28T12:57:24Z",
    "resolution": "FIXED",
    "status": "RESOLVED",
    "summary": "[13/14/15/16 Regression] ICE in delete_root, at fortran/bbt.c:150",
    "url": "https://gcc.gnu.org/bugzilla/show_bug.cgi?id=84245"
  },
  "classification": {
    "regression": true,
    "severity": "ice-on-invalid",
    "validity_class": "invalid-code"
  },
  "fix_status": "merged",
  "github_issue": 57,
  "notes": "Direct reproducer no longer ICEs on clean trunk; invalid source still exits nonzero with frontend diagnostics only. Targeted testcase and repeated full check-gfortran reruns on pr84245-fix passed locally with 0 FAIL / XPASS.",
  "pr": 84245,
  "submission_status": {
    "on_bugzilla": true,
    "on_mailing_list": false,
    "sent": false
  },
  "title": "ICE in `delete_root` during invalid `SELECT TYPE`",
  "trunk": {
    "branch": null,
    "commit": "486169386603627f0cf2a5f12ea4f73a20d6df20",
    "patch": "0001-fortran-Avoid-rollback-ICE-after-invalid-SELECT-TYPE.patch"
  },
  "updated_at": "2026-03-28T14:09:57Z",
  "validation": {
    "baseline": {
      "contains_any": [
        "internal compiler error",
        "ICE in"
      ],
      "exit": "nonzero",
      "not_contains": []
    },
    "compile": [
      "gcc-trunk-build/gcc/gfortran",
      "-B",
      "gcc-trunk-build/gcc",
      "-c",
      "pr/84245/reproducer.f90",
      "-o",
      "/dev/null"
    ],
    "env": {},
    "fixed": {
      "contains_any": [
        "Unexpected '%'",
        "Expecting END PROGRAM statement"
      ],
      "exit": "nonzero",
      "not_contains": [
        "internal compiler error"
      ]
    },
    "kind": "compile",
    "run": []
  }
}
