{
  "artifacts": {
    "bugzilla_comment": "submission/bugzilla-comment.txt",
    "mailing_list_cover": "submission/mailing-list-cover.txt",
    "maintainer_summary": "submission/maintainer-summary.md"
  },
  "backports": {
    "gcc-13": {
      "apply_mode": "unknown",
      "backport_candidate": null,
      "branch_commit": null,
      "branch_patch": null,
      "full_suite": "not-run",
      "notes": "",
      "reproduces": null,
      "targeted_tests": "not-run"
    },
    "gcc-14": {
      "apply_mode": "unknown",
      "backport_candidate": null,
      "branch_commit": null,
      "branch_patch": null,
      "full_suite": "not-run",
      "notes": "",
      "reproduces": null,
      "targeted_tests": "not-run"
    },
    "gcc-15": {
      "apply_mode": "unknown",
      "backport_candidate": null,
      "branch_commit": null,
      "branch_patch": null,
      "full_suite": "not-run",
      "notes": "",
      "reproduces": null,
      "targeted_tests": "not-run"
    }
  },
  "bugzilla": {
    "id": 124512,
    "keywords": [
      "build"
    ],
    "refreshed_at": "2026-04-14T07:52:41Z",
    "resolution": "FIXED",
    "status": "RESOLVED",
    "summary": "[16 Regression] libgfortran shmem caf: NetBSD has no pthread_condattr_setpshared",
    "url": "https://gcc.gnu.org/bugzilla/show_bug.cgi?id=124512"
  },
  "classification": {
    "regression": true,
    "severity": "runtime-crash",
    "validity_class": "valid-code"
  },
  "fix_status": "merged",
  "github_issue": 104,
  "notes": "Updated patch remains on Bugzilla as attachment 63985. A fresh full check-gfortran rerun on pr124512-fix finished clean with 0 FAIL / XPASS.",
  "pr": 124512,
  "submission_status": {
    "on_bugzilla": true,
    "on_mailing_list": false,
    "sent": false
  },
  "title": "libgfortran shmem caf: NetBSD lacks usable process-shared pthread support",
  "trunk": {
    "branch": null,
    "commit": "f57bcde85984d2751f7bc5fd8e3de11f5dc1255",
    "patch": "0001-libgfortran-Disable-caf_shmem-without-usable-process.patch"
  },
  "updated_at": "2026-04-14T07:52:41Z",
  "validation": {
    "baseline": {
      "contains_any": [
        "internal compiler error",
        "ICE in"
      ],
      "exit": "nonzero",
      "not_contains": []
    },
    "compile": [
      "gcc-build/gcc/gfortran",
      "-B",
      "gcc-build/gcc",
      "-c",
      "pr/124512/reproducer.f90",
      "-o",
      "/dev/null"
    ],
    "env": {},
    "fixed": {
      "contains_any": [],
      "exit": "zero",
      "not_contains": [
        "internal compiler error"
      ]
    },
    "kind": "compile",
    "run": []
  }
}
