{
  "artifacts": {
    "bugzilla_comment": "submission/bugzilla-comment.txt",
    "mailing_list_cover": "submission/mailing-list-cover.txt",
    "maintainer_summary": "submission/maintainer-summary.md"
  },
  "backports": {
    "gcc-13": {
      "apply_mode": "unknown",
      "backport_candidate": null,
      "branch_commit": null,
      "branch_patch": null,
      "full_suite": "not-run",
      "notes": "",
      "reproduces": null,
      "targeted_tests": "not-run"
    },
    "gcc-14": {
      "apply_mode": "unknown",
      "backport_candidate": null,
      "branch_commit": null,
      "branch_patch": null,
      "full_suite": "not-run",
      "notes": "",
      "reproduces": null,
      "targeted_tests": "not-run"
    },
    "gcc-15": {
      "apply_mode": "unknown",
      "backport_candidate": null,
      "branch_commit": null,
      "branch_patch": null,
      "full_suite": "not-run",
      "notes": "",
      "reproduces": null,
      "targeted_tests": "not-run"
    }
  },
  "bugzilla": {
    "id": 108382,
    "keywords": [
      "openacc",
      "openmp",
      "rejects-valid"
    ],
    "last_change_time": "2026-04-17T17:00:09Z",
    "last_synced_utc": "2026-06-19T12:41:25Z",
    "refreshed_at": "2026-06-19T12:41:25Z",
    "resolution": "FIXED",
    "status": "RESOLVED",
    "summary": "[13/14/15 Regression] Incorrect parsing when acc and omp coexist and -fopenmp -fopenacc is used.",
    "url": "https://gcc.gnu.org/bugzilla/show_bug.cgi?id=108382"
  },
  "classification": {
    "regression": true,
    "severity": "wrong-code",
    "validity_class": "valid-code"
  },
  "fix_status": "merged",
  "github_issue": 110,
  "notes": "Patch posted to Bugzilla as attachment 63999. Validation on pr108382-fix is now complete: original and reduced reproducers fixed, preserved negative case still diagnoses, goacc.exp=omp-108382.f90 passes, goacc.exp=omp.f95 passes, the broader goacc.exp sweep is clean, and a fresh full check-gfortran rerun finished with 0 FAIL / XPASS.",
  "pr": 108382,
  "submission_status": {
    "on_bugzilla": true,
    "on_mailing_list": false,
    "sent": false
  },
  "title": "Mixed OpenACC/OpenMP continuation misparse",
  "trunk": {
    "branch": "pr108382-fix",
    "commit": "3d4039e95d851b5e3d8241b1feaf1d5dcc00cb98",
    "patch": "0001-fortran-Fix-free-form-mixed-OpenACC-OpenMP-continuat.patch"
  },
  "updated_at": "2026-06-19T12:41:45Z",
  "validation": {
    "baseline": {
      "contains_any": [
        "Wrong OpenACC continuation",
        "Wrong OpenMP continuation",
        "Syntax error in !$OMP DECLARE TARGET list",
        "Unclassifiable OpenMP directive"
      ],
      "exit": "nonzero",
      "not_contains": []
    },
    "compile": [
      "gcc-trunk-build/gcc/gfortran",
      "-B",
      "gcc-trunk-build/gcc",
      "-c",
      "-fopenmp",
      "-fopenacc",
      "pr/108382/reproducer.f90",
      "-o",
      "/dev/null"
    ],
    "env": {},
    "fixed": {
      "contains_any": [],
      "exit": "zero",
      "not_contains": [
        "Wrong OpenACC continuation",
        "Wrong OpenMP continuation",
        "Syntax error in !$OMP DECLARE TARGET list",
        "Unclassifiable OpenMP directive"
      ]
    },
    "kind": "compile",
    "run": []
  }
}
