{
  "artifacts": {
    "bugzilla_comment": "submission/bugzilla-comment.txt",
    "mailing_list_cover": "submission/mailing-list-cover.txt",
    "maintainer_summary": "submission/maintainer-summary.md"
  },
  "backports": {
    "gcc-13": {
      "apply_mode": "unknown",
      "backport_candidate": null,
      "branch_commit": null,
      "branch_patch": null,
      "full_suite": "not-run",
      "notes": "",
      "reproduces": null,
      "targeted_tests": "not-run"
    },
    "gcc-14": {
      "apply_mode": "unknown",
      "backport_candidate": null,
      "branch_commit": null,
      "branch_patch": null,
      "full_suite": "not-run",
      "notes": "",
      "reproduces": null,
      "targeted_tests": "not-run"
    },
    "gcc-15": {
      "apply_mode": "unknown",
      "backport_candidate": null,
      "branch_commit": null,
      "branch_patch": null,
      "full_suite": "not-run",
      "notes": "",
      "reproduces": null,
      "targeted_tests": "not-run"
    }
  },
  "bugzilla": {
    "id": 122491,
    "url": "https://gcc.gnu.org/bugzilla/show_bug.cgi?id=122491"
  },
  "classification": {
    "regression": true,
    "severity": "ice-on-invalid",
    "validity_class": "invalid-code"
  },
  "fix_status": "merged",
  "github_issue": 50,
  "notes": "",
  "pr": 122491,
  "submission_status": {
    "on_bugzilla": false,
    "on_mailing_list": false,
    "sent": false
  },
  "title": "[16 Regression] ASAN UAF in missing END BLOCK recovery",
  "trunk": {
    "branch": null,
    "commit": "ff2f6c5153e",
    "patch": "0001-fortran-Avoid-UAF-on-missing-END-BLOCK-cleanup-PR122.patch"
  },
  "updated_at": "2026-03-11T19:41:19Z",
  "validation": {
    "compile": [
      "gcc-build/gcc/gfortran",
      "-B",
      "gcc-build/gcc",
      "-c",
      "pr/122491/reproducer.f90",
      "-o",
      "/dev/null"
    ],
    "env": {},
    "kind": "compile",
    "run": []
  }
}
