{
  "artifacts": {
    "bugzilla_comment": "submission/bugzilla-comment.txt",
    "mailing_list_cover": "submission/mailing-list-cover.txt",
    "maintainer_summary": "submission/maintainer-summary.md"
  },
  "backports": {
    "gcc-13": {
      "apply_mode": "unknown",
      "backport_candidate": null,
      "branch_commit": null,
      "branch_patch": null,
      "full_suite": "not-run",
      "notes": "",
      "reproduces": null,
      "targeted_tests": "not-run"
    },
    "gcc-14": {
      "apply_mode": "unknown",
      "backport_candidate": null,
      "branch_commit": null,
      "branch_patch": null,
      "full_suite": "not-run",
      "notes": "",
      "reproduces": null,
      "targeted_tests": "not-run"
    },
    "gcc-15": {
      "apply_mode": "unknown",
      "backport_candidate": null,
      "branch_commit": null,
      "branch_patch": null,
      "full_suite": "not-run",
      "notes": "",
      "reproduces": null,
      "targeted_tests": "not-run"
    }
  },
  "bugzilla": {
    "id": 32365,
    "keywords": [
      "diagnostic"
    ],
    "last_change_time": "2026-04-01T18:28:12Z",
    "last_synced_utc": "2026-06-11T21:26:29Z",
    "refreshed_at": "2026-06-11T21:26:29Z",
    "resolution": "FIXED",
    "status": "RESOLVED",
    "summary": "Better error message for specification statement in executable section",
    "url": "https://gcc.gnu.org/bugzilla/show_bug.cgi?id=32365"
  },
  "classification": {
    "regression": false,
    "severity": "other",
    "validity_class": "valid-code"
  },
  "fix_status": "merged",
  "github_issue": 3,
  "notes": "",
  "pr": 32365,
  "submission_status": {
    "on_bugzilla": false,
    "on_mailing_list": false,
    "sent": false
  },
  "title": "GCC Bug 32365 - Better error message for specification statement in executable section",
  "trunk": {
    "branch": null,
    "commit": "0ec9191dae0ea4b1316d4969bd16df55b299331c",
    "patch": "0001-fortran-enforce-spec-statements-ordering.patch"
  },
  "updated_at": "2026-06-11T21:26:30Z",
  "validation": {
    "baseline": {
      "contains_any": [
        "internal compiler error",
        "ICE in"
      ],
      "exit": "nonzero",
      "not_contains": []
    },
    "compile": [
      "gcc-build/gcc/gfortran",
      "-B",
      "gcc-build/gcc",
      "-c",
      "pr/32365/reproducer.f90",
      "-o",
      "/dev/null"
    ],
    "env": {},
    "fixed": {
      "contains_any": [],
      "exit": "zero",
      "not_contains": [
        "internal compiler error"
      ]
    },
    "kind": "compile",
    "run": []
  }
}
