{
  "artifacts": {
    "bugzilla_comment": "submission/bugzilla-comment.txt",
    "mailing_list_cover": "submission/mailing-list-cover.txt",
    "maintainer_summary": "submission/maintainer-summary.md"
  },
  "backports": {
    "gcc-13": {
      "apply_mode": "unknown",
      "backport_candidate": null,
      "branch_commit": null,
      "branch_patch": null,
      "full_suite": "not-run",
      "notes": "",
      "reproduces": null,
      "targeted_tests": "not-run"
    },
    "gcc-14": {
      "apply_mode": "unknown",
      "backport_candidate": null,
      "branch_commit": null,
      "branch_patch": null,
      "full_suite": "not-run",
      "notes": "",
      "reproduces": null,
      "targeted_tests": "not-run"
    },
    "gcc-15": {
      "apply_mode": "unknown",
      "backport_candidate": null,
      "branch_commit": null,
      "branch_patch": null,
      "full_suite": "not-run",
      "notes": "",
      "reproduces": null,
      "targeted_tests": "not-run"
    }
  },
  "bugzilla": {
    "id": 95338,
    "keywords": [
      "ice-on-valid-code"
    ],
    "refreshed_at": "2026-03-29T11:23:58Z",
    "resolution": "",
    "status": "NEW",
    "summary": "[13/14/15/16 Regression] ICE non-trivial conversion in component_ref",
    "url": "https://gcc.gnu.org/bugzilla/show_bug.cgi?id=95338"
  },
  "classification": {
    "regression": true,
    "severity": "ice-on-valid",
    "validity_class": "valid-code"
  },
  "fix_status": "merged",
  "github_issue": 68,
  "notes": "",
  "pr": 95338,
  "submission_status": {
    "on_bugzilla": false,
    "on_mailing_list": false,
    "sent": false
  },
  "title": "ICE on mixed ENTRY result types with `-ff2c`",
  "trunk": {
    "branch": null,
    "commit": null,
    "patch": "0001-fortran-Fix-mixed-ENTRY-union-ABI-under-ff2c-PR95338.patch"
  },
  "updated_at": "2026-03-29T11:23:58Z",
  "validation": {
    "baseline": {
      "contains_any": [
        "internal compiler error",
        "ICE in"
      ],
      "exit": "nonzero",
      "not_contains": []
    },
    "compile": [
      "gcc-build/gcc/gfortran",
      "-B",
      "gcc-build/gcc",
      "-c",
      "pr/95338/reproducer.f90",
      "-o",
      "/dev/null"
    ],
    "env": {},
    "fixed": {
      "contains_any": [],
      "exit": "zero",
      "not_contains": [
        "internal compiler error"
      ]
    },
    "kind": "compile",
    "run": []
  }
}
