{
  "artifacts": {
    "bugzilla_comment": "submission/bugzilla-comment.txt",
    "mailing_list_cover": "submission/mailing-list-cover.txt",
    "maintainer_summary": "submission/maintainer-summary.md"
  },
  "backports": {
    "gcc-13": {
      "apply_mode": "unknown",
      "backport_candidate": null,
      "branch_commit": null,
      "branch_patch": null,
      "full_suite": "not-run",
      "notes": "",
      "reproduces": null,
      "targeted_tests": "not-run"
    },
    "gcc-14": {
      "apply_mode": "unknown",
      "backport_candidate": null,
      "branch_commit": null,
      "branch_patch": null,
      "full_suite": "not-run",
      "notes": "",
      "reproduces": null,
      "targeted_tests": "not-run"
    },
    "gcc-15": {
      "apply_mode": "unknown",
      "backport_candidate": null,
      "branch_commit": null,
      "branch_patch": null,
      "full_suite": "not-run",
      "notes": "",
      "reproduces": null,
      "targeted_tests": "not-run"
    }
  },
  "bugzilla": {
    "id": 96080,
    "keywords": [
      "openacc"
    ],
    "refreshed_at": "2026-03-29T11:23:34Z",
    "resolution": "",
    "status": "WAITING",
    "summary": "OpenACC/Fortran runtime library routines vs. Fortran 'pointer'",
    "url": "https://gcc.gnu.org/bugzilla/show_bug.cgi?id=96080"
  },
  "classification": {
    "regression": false,
    "severity": "runtime-crash",
    "validity_class": "valid-code"
  },
  "fix_status": "patch-ready",
  "github_issue": 12,
  "notes": "",
  "pr": 123280,
  "submission_status": {
    "on_bugzilla": false,
    "on_mailing_list": false,
    "sent": false
  },
  "title": "+ 123280: OpenACC Fortran runtime routines vs assumed-shape/pointers",
  "trunk": {
    "branch": "openacc",
    "commit": null,
    "patch": "0001-libgomp-Remove-contiguous-from-assumed-rank-array_h-.patch"
  },
  "updated_at": "2026-03-29T11:23:34Z",
  "validation": {
    "baseline": {
      "contains_any": [
        "internal compiler error",
        "ICE in"
      ],
      "exit": "nonzero",
      "not_contains": []
    },
    "compile": [
      "gcc-build/gcc/gfortran",
      "-B",
      "gcc-build/gcc",
      "-c",
      "pr/123280/reproducer.f90",
      "-o",
      "/dev/null"
    ],
    "env": {},
    "fixed": {
      "contains_any": [],
      "exit": "zero",
      "not_contains": [
        "internal compiler error"
      ]
    },
    "kind": "compile",
    "run": []
  }
}
