{
  "artifacts": {
    "bugzilla_comment": "submission/bugzilla-comment.txt",
    "mailing_list_cover": "submission/mailing-list-cover.txt",
    "maintainer_summary": "submission/maintainer-summary.md"
  },
  "backports": {
    "gcc-13": {
      "apply_mode": "unknown",
      "backport_candidate": null,
      "branch_commit": null,
      "branch_patch": null,
      "full_suite": "not-run",
      "notes": "",
      "reproduces": null,
      "targeted_tests": "not-run"
    },
    "gcc-14": {
      "apply_mode": "unknown",
      "backport_candidate": null,
      "branch_commit": null,
      "branch_patch": null,
      "full_suite": "not-run",
      "notes": "",
      "reproduces": null,
      "targeted_tests": "not-run"
    },
    "gcc-15": {
      "apply_mode": "unknown",
      "backport_candidate": null,
      "branch_commit": null,
      "branch_patch": null,
      "full_suite": "not-run",
      "notes": "",
      "reproduces": null,
      "targeted_tests": "not-run"
    }
  },
  "bugzilla": {
    "id": 100194,
    "keywords": [],
    "refreshed_at": "2026-04-14T07:52:03Z",
    "resolution": "FIXED",
    "status": "RESOLVED",
    "summary": "[13/14/ Regression] ICE in gfc_trans_create_temp_array, at fortran/trans-array.c:1351",
    "url": "https://gcc.gnu.org/bugzilla/show_bug.cgi?id=100194"
  },
  "classification": {
    "regression": true,
    "severity": "runtime-crash",
    "validity_class": "valid-code"
  },
  "fix_status": "merged",
  "github_issue": null,
  "notes": "",
  "pr": 100194,
  "submission_status": {
    "on_bugzilla": false,
    "on_mailing_list": false,
    "sent": false
  },
  "title": "ICE in gfc_trans_create_temp_array with assumed-rank + contiguous",
  "trunk": {
    "branch": null,
    "commit": null,
    "patch": "0001-fortran-Fix-ICE-in-gfc_trans_create_temp_array-for-a.patch"
  },
  "updated_at": "2026-04-14T07:52:03Z",
  "validation": {
    "baseline": {
      "contains_any": [
        "internal compiler error",
        "ICE in"
      ],
      "exit": "nonzero",
      "not_contains": []
    },
    "compile": [
      "gcc-build/gcc/gfortran",
      "-B",
      "gcc-build/gcc",
      "-c",
      "pr/100194/reproducer.f90",
      "-o",
      "/dev/null"
    ],
    "env": {},
    "fixed": {
      "contains_any": [],
      "exit": "zero",
      "not_contains": [
        "internal compiler error"
      ]
    },
    "kind": "compile",
    "run": []
  }
}
