{
  "artifacts": {
    "bugzilla_comment": "submission/bugzilla-comment.txt",
    "mailing_list_cover": "submission/mailing-list-cover.txt",
    "maintainer_summary": "submission/maintainer-summary.md"
  },
  "backports": {
    "gcc-13": {
      "apply_mode": "unknown",
      "backport_candidate": null,
      "branch_commit": null,
      "branch_patch": null,
      "full_suite": "not-run",
      "notes": "",
      "reproduces": null,
      "targeted_tests": "not-run"
    },
    "gcc-14": {
      "apply_mode": "unknown",
      "backport_candidate": null,
      "branch_commit": null,
      "branch_patch": null,
      "full_suite": "not-run",
      "notes": "",
      "reproduces": null,
      "targeted_tests": "not-run"
    },
    "gcc-15": {
      "apply_mode": "unknown",
      "backport_candidate": null,
      "branch_commit": null,
      "branch_patch": null,
      "full_suite": "not-run",
      "notes": "",
      "reproduces": null,
      "targeted_tests": "not-run"
    }
  },
  "bugzilla": {
    "id": 42954,
    "keywords": [
      "patch"
    ],
    "last_change_time": "2026-04-16T17:50:16Z",
    "last_synced_utc": "2026-06-11T21:26:31Z",
    "refreshed_at": "2026-06-11T21:26:31Z",
    "resolution": "",
    "status": "NEW",
    "summary": "TARGET_*_CPP_BUILTINS issues with gfortran / Target macros missing (C preprocessor)",
    "url": "https://gcc.gnu.org/bugzilla/show_bug.cgi?id=42954"
  },
  "classification": {
    "regression": false,
    "severity": "other",
    "validity_class": "valid-code"
  },
  "fix_status": "patch-ready",
  "github_issue": 52,
  "notes": "",
  "pr": 42954,
  "submission_status": {
    "on_bugzilla": false,
    "on_mailing_list": false,
    "sent": false
  },
  "title": "Target CPP builtins missing in gfortran -cpp",
  "trunk": {
    "branch": null,
    "commit": null,
    "patch": "0001-fortran-Enable-target-preprocessor-macros-with-cpp-P.patch"
  },
  "updated_at": "2026-06-11T21:26:43Z",
  "validation": {
    "baseline": {
      "contains_any": [
        "internal compiler error",
        "ICE in"
      ],
      "exit": "nonzero",
      "not_contains": []
    },
    "compile": [
      "gcc-build/gcc/gfortran",
      "-B",
      "gcc-build/gcc",
      "-c",
      "pr/42954/reproducer.f90",
      "-o",
      "/dev/null"
    ],
    "env": {},
    "fixed": {
      "contains_any": [],
      "exit": "zero",
      "not_contains": [
        "internal compiler error"
      ]
    },
    "kind": "compile",
    "run": []
  }
}
