{
  "artifacts": {
    "bugzilla_comment": "submission/bugzilla-comment.txt",
    "mailing_list_cover": "submission/mailing-list-cover.txt",
    "maintainer_summary": "submission/maintainer-summary.md"
  },
  "backports": {
    "gcc-13": {
      "apply_mode": "validated-targeted",
      "backport_candidate": true,
      "branch_commit": "ffefe58e40d3f17ae3cedc7d865f909caeb38c58",
      "branch_patch": "backports/gcc-13/0001-fortran-Reject-array-allocatable-LINEAR-on-DO-PR1024.patch",
      "full_suite": "not-run",
      "notes": "targeted tests passed: gomp/pr102430.f90",
      "reproduces": true,
      "targeted_tests": "pass"
    },
    "gcc-14": {
      "apply_mode": "validated-targeted",
      "backport_candidate": true,
      "branch_commit": "93c57cb681a2800eef139d3014ef652d29a3a317",
      "branch_patch": "backports/gcc-14/0001-fortran-Reject-array-allocatable-LINEAR-on-DO-PR1024.patch",
      "full_suite": "not-run",
      "notes": "targeted tests passed: gomp/pr102430.f90",
      "reproduces": true,
      "targeted_tests": "pass"
    },
    "gcc-15": {
      "apply_mode": "validated-targeted",
      "backport_candidate": true,
      "branch_commit": "3f9b7014d3a3d86be9a852078ce8fcb362093586",
      "branch_patch": "backports/gcc-15/0001-fortran-Reject-array-allocatable-LINEAR-on-DO-PR1024.patch",
      "full_suite": "not-run",
      "notes": "targeted tests passed: gomp/pr102430.f90",
      "reproduces": true,
      "targeted_tests": "pass"
    }
  },
  "bugzilla": {
    "id": 102430,
    "keywords": [
      "ice-on-valid-code",
      "openmp"
    ],
    "refreshed_at": "2026-03-28T12:56:46Z",
    "resolution": "",
    "status": "NEW",
    "summary": "[13/14/15/16 Regression] ICE in fold_convert_loc, at fold-const.c:2554 since r7-4447-gb4c3a85be9658537",
    "url": "https://gcc.gnu.org/bugzilla/show_bug.cgi?id=102430"
  },
  "classification": {
    "regression": true,
    "severity": "ice-on-valid",
    "validity_class": "valid-code"
  },
  "fix_status": "patch-ready",
  "github_issue": 9,
  "notes": "",
  "pr": 102430,
  "submission_status": {
    "on_bugzilla": false,
    "on_mailing_list": false,
    "sent": false
  },
  "title": "GCC PR102430 \u2013 OpenMP linear(array) ICE / missing support",
  "trunk": {
    "branch": null,
    "commit": "d498fe6e019",
    "patch": "0001-fortran-Reject-array-allocatable-LINEAR-on-DO-PR1024.patch"
  },
  "updated_at": "2026-03-28T14:09:57Z",
  "validation": {
    "baseline": {
      "contains_any": [
        "internal compiler error",
        "ICE in"
      ],
      "exit": "nonzero",
      "not_contains": []
    },
    "compile": [
      "gcc-build/gcc/gfortran",
      "-B",
      "gcc-build/gcc",
      "-fopenmp",
      "-c",
      "pr/102430/reproducer.f90",
      "-o",
      "/dev/null"
    ],
    "env": {},
    "fixed": {
      "contains_any": [
        "Sorry, not yet supported",
        "not yet supported"
      ],
      "exit": "nonzero",
      "not_contains": [
        "internal compiler error"
      ]
    },
    "kind": "compile",
    "run": []
  }
}
