{
  "artifacts": {
    "bugzilla_comment": "submission/bugzilla-comment.txt",
    "mailing_list_cover": "submission/mailing-list-cover.txt",
    "maintainer_summary": "submission/maintainer-summary.md"
  },
  "backports": {
    "gcc-13": {
      "apply_mode": "unknown",
      "backport_candidate": null,
      "branch_commit": null,
      "branch_patch": null,
      "full_suite": "not-run",
      "notes": "",
      "reproduces": null,
      "targeted_tests": "not-run"
    },
    "gcc-14": {
      "apply_mode": "unknown",
      "backport_candidate": null,
      "branch_commit": null,
      "branch_patch": null,
      "full_suite": "not-run",
      "notes": "",
      "reproduces": null,
      "targeted_tests": "not-run"
    },
    "gcc-15": {
      "apply_mode": "unknown",
      "backport_candidate": null,
      "branch_commit": null,
      "branch_patch": null,
      "full_suite": "not-run",
      "notes": "",
      "reproduces": null,
      "targeted_tests": "not-run"
    }
  },
  "bugzilla": {
    "id": 123254,
    "keywords": [],
    "refreshed_at": "2026-03-28T12:57:03Z",
    "resolution": "WORKSFORME",
    "status": "RESOLVED",
    "summary": "OpenACC: SIGSEGV in GOACC_parallel_keyed when using present() clause for derived type dummy argument",
    "url": "https://gcc.gnu.org/bugzilla/show_bug.cgi?id=123254"
  },
  "classification": {
    "regression": false,
    "severity": "runtime-crash",
    "validity_class": "valid-code"
  },
  "fix_status": "worksforme",
  "github_issue": null,
  "notes": "",
  "pr": 123254,
  "submission_status": {
    "on_bugzilla": false,
    "on_mailing_list": false,
    "sent": false
  },
  "title": "OpenACC present() on DT dummy arg (worksforme)",
  "trunk": {
    "branch": null,
    "commit": "769041822723208bf85a91ac409b9b0bdae3fff0",
    "patch": null
  },
  "updated_at": "2026-03-28T16:27:43Z",
  "validation": {
    "baseline": {
      "contains_any": [
        "internal compiler error",
        "ICE in"
      ],
      "exit": "nonzero",
      "not_contains": []
    },
    "compile": [
      "gcc-build/gcc/gfortran",
      "-B",
      "gcc-build/gcc",
      "-c",
      "pr/123254/reproducer.f90",
      "-o",
      "/dev/null"
    ],
    "env": {},
    "fixed": {
      "contains_any": [],
      "exit": "zero",
      "not_contains": [
        "internal compiler error"
      ]
    },
    "kind": "compile",
    "run": []
  }
}
