{
  "artifacts": {
    "bugzilla_comment": "submission/bugzilla-comment.txt",
    "mailing_list_cover": "submission/mailing-list-cover.txt",
    "maintainer_summary": "submission/maintainer-summary.md"
  },
  "backports": {
    "gcc-13": {
      "apply_mode": "unknown",
      "backport_candidate": null,
      "branch_commit": null,
      "branch_patch": null,
      "full_suite": "not-run",
      "notes": "",
      "reproduces": null,
      "targeted_tests": "not-run"
    },
    "gcc-14": {
      "apply_mode": "unknown",
      "backport_candidate": null,
      "branch_commit": null,
      "branch_patch": null,
      "full_suite": "not-run",
      "notes": "",
      "reproduces": null,
      "targeted_tests": "not-run"
    },
    "gcc-15": {
      "apply_mode": "unknown",
      "backport_candidate": null,
      "branch_commit": null,
      "branch_patch": null,
      "full_suite": "not-run",
      "notes": "",
      "reproduces": null,
      "targeted_tests": "not-run"
    }
  },
  "bugzilla": {
    "id": 95879,
    "keywords": [
      "ice-on-invalid-code"
    ],
    "refreshed_at": "2026-03-28T12:57:31Z",
    "resolution": "",
    "status": "NEW",
    "summary": "[13/14/15 Regression] ICE in gfc_resolve_formal_arglist, at fortran/resolve.c:313",
    "url": "https://gcc.gnu.org/bugzilla/show_bug.cgi?id=95879"
  },
  "classification": {
    "regression": true,
    "severity": "ice-on-valid",
    "validity_class": "valid-code"
  },
  "fix_status": "patch-ready",
  "github_issue": 69,
  "notes": "Patch remains on Bugzilla. A fresh full check-gfortran rerun on pr95879-fix finished clean with 0 FAIL / XPASS.",
  "pr": 95879,
  "submission_status": {
    "on_bugzilla": true,
    "on_mailing_list": false,
    "sent": false
  },
  "title": "Use-after-free in gfc_resolve_formal_arglist",
  "trunk": {
    "branch": "pr95879-fix",
    "commit": "e2bb459d5d99d52b2b58656665fe0b9611b601be",
    "patch": "0001-fortran-Fix-use-after-free-in-gfc_fixup_sibling_symb.patch"
  },
  "updated_at": "2026-03-28T12:57:31Z",
  "validation": {
    "baseline": {
      "contains_any": [
        "internal compiler error",
        "ICE in"
      ],
      "exit": "nonzero",
      "not_contains": []
    },
    "compile": [
      "gcc-build/gcc/gfortran",
      "-B",
      "gcc-build/gcc",
      "-c",
      "pr/95879/y1.f90",
      "-o",
      "/dev/null"
    ],
    "env": {},
    "fixed": {
      "contains_any": [],
      "exit": "zero",
      "not_contains": [
        "internal compiler error"
      ]
    },
    "kind": "compile",
    "run": []
  }
}
