{
  "artifacts": {
    "bugzilla_comment": "submission/bugzilla-comment.txt",
    "mailing_list_cover": "submission/mailing-list-cover.txt",
    "maintainer_summary": "submission/maintainer-summary.md"
  },
  "backports": {
    "gcc-13": {
      "apply_mode": "unknown",
      "backport_candidate": null,
      "branch_commit": null,
      "branch_patch": null,
      "full_suite": "not-run",
      "notes": "",
      "reproduces": null,
      "targeted_tests": "not-run"
    },
    "gcc-14": {
      "apply_mode": "unknown",
      "backport_candidate": null,
      "branch_commit": null,
      "branch_patch": null,
      "full_suite": "not-run",
      "notes": "",
      "reproduces": null,
      "targeted_tests": "not-run"
    },
    "gcc-15": {
      "apply_mode": "unknown",
      "backport_candidate": null,
      "branch_commit": null,
      "branch_patch": null,
      "full_suite": "not-run",
      "notes": "",
      "reproduces": null,
      "targeted_tests": "not-run"
    }
  },
  "bugzilla": {
    "id": 90519,
    "keywords": [],
    "refreshed_at": "2026-03-28T12:57:26Z",
    "resolution": "",
    "status": "NEW",
    "summary": "ICE (segfault) on derived type which has a recursive allocatable component of the same type, and a static component of another type which has a \"final\" attribute",
    "url": "https://gcc.gnu.org/bugzilla/show_bug.cgi?id=90519"
  },
  "classification": {
    "regression": false,
    "severity": "runtime-crash",
    "validity_class": "valid-code"
  },
  "fix_status": "merged",
  "github_issue": 4,
  "notes": "",
  "pr": 90519,
  "submission_status": {
    "on_bugzilla": false,
    "on_mailing_list": false,
    "sent": false
  },
  "title": "GCC PR90519 \u2013 FINAL + recursive allocatable ICE",
  "trunk": {
    "branch": null,
    "commit": "1eb696fc092",
    "patch": "0001-fortran-Fix-ICE-and-self-assignment-bugs-with-recurs.patch"
  },
  "updated_at": "2026-03-28T12:57:26Z",
  "validation": {
    "baseline": {
      "contains_any": [
        "internal compiler error",
        "ICE in"
      ],
      "exit": "nonzero",
      "not_contains": []
    },
    "compile": [
      "gcc-build/gcc/gfortran",
      "-B",
      "gcc-build/gcc",
      "-c",
      "pr/90519/finalizer_min.f90",
      "-o",
      "/dev/null"
    ],
    "env": {},
    "fixed": {
      "contains_any": [],
      "exit": "zero",
      "not_contains": [
        "internal compiler error"
      ]
    },
    "kind": "compile",
    "run": []
  }
}
