{
  "artifacts": {
    "bugzilla_comment": "submission/bugzilla-comment.txt",
    "mailing_list_cover": "submission/mailing-list-cover.txt",
    "maintainer_summary": "submission/maintainer-summary.md"
  },
  "backports": {
    "gcc-13": {
      "apply_mode": "unknown",
      "backport_candidate": null,
      "branch_commit": null,
      "branch_patch": null,
      "full_suite": "not-run",
      "notes": "",
      "reproduces": null,
      "targeted_tests": "not-run"
    },
    "gcc-14": {
      "apply_mode": "unknown",
      "backport_candidate": null,
      "branch_commit": null,
      "branch_patch": null,
      "full_suite": "not-run",
      "notes": "",
      "reproduces": null,
      "targeted_tests": "not-run"
    },
    "gcc-15": {
      "apply_mode": "unknown",
      "backport_candidate": null,
      "branch_commit": null,
      "branch_patch": null,
      "full_suite": "not-run",
      "notes": "",
      "reproduces": null,
      "targeted_tests": "not-run"
    }
  },
  "bugzilla": {
    "id": 107425,
    "keywords": [
      "openmp"
    ],
    "last_change_time": "2026-05-09T07:05:27Z",
    "last_synced_utc": "2026-05-27T18:13:23Z",
    "refreshed_at": "2026-05-27T18:13:23Z",
    "resolution": "FIXED",
    "status": "RESOLVED",
    "summary": "[13/14/15 Regression] ICE in gimplify_var_or_parm_decl, at gimplify.cc:3060 since r12-6780-gd2ad748eeef0dd26",
    "url": "https://gcc.gnu.org/bugzilla/show_bug.cgi?id=107425"
  },
  "classification": {
    "regression": true,
    "severity": "ice-on-valid",
    "validity_class": "valid-code"
  },
  "fix_status": "merged",
  "github_issue": 89,
  "notes": "Paul Thomas's regression table recorded this as already pushed to the 16 branch with a short backport hold. Actual upstream/master now contains the fix commit, so GitHub should reflect it as merged upstream.",
  "pr": 107425,
  "submission_status": {
    "on_bugzilla": true,
    "on_mailing_list": false,
    "sent": false
  },
  "title": "ICE in gimplify_var_or_parm_decl with implicit var in iterator depend clause",
  "trunk": {
    "branch": null,
    "commit": "d26055fec8ef07d9b998ec3217b25507ad080fcf",
    "patch": "0001-fortran-Fix-ICE-with-implicit-variable-in-iterator-d.patch"
  },
  "updated_at": "2026-05-27T18:13:23Z",
  "validation": {
    "baseline": {
      "contains_any": [
        "internal compiler error",
        "ICE in"
      ],
      "exit": "nonzero",
      "not_contains": []
    },
    "compile": [
      "gcc-build/gcc/gfortran",
      "-B",
      "gcc-build/gcc",
      "-c",
      "pr/107425/reproducer.f90",
      "-o",
      "/dev/null"
    ],
    "env": {},
    "fixed": {
      "contains_any": [],
      "exit": "zero",
      "not_contains": [
        "internal compiler error"
      ]
    },
    "kind": "compile",
    "run": []
  }
}
