{
  "artifacts": {
    "bugzilla_comment": "submission/bugzilla-comment.txt",
    "mailing_list_cover": "submission/mailing-list-cover.txt",
    "maintainer_summary": "submission/maintainer-summary.md"
  },
  "backports": {
    "gcc-13": {
      "apply_mode": "not-affected",
      "backport_candidate": false,
      "branch_commit": null,
      "branch_patch": null,
      "full_suite": "not-run",
      "notes": "baseline branch compiler does not match the recorded reproducer signature",
      "reproduces": false,
      "targeted_tests": "not-run"
    },
    "gcc-14": {
      "apply_mode": "not-affected",
      "backport_candidate": false,
      "branch_commit": null,
      "branch_patch": null,
      "full_suite": "not-run",
      "notes": "baseline branch compiler does not match the recorded reproducer signature",
      "reproduces": false,
      "targeted_tests": "not-run"
    },
    "gcc-15": {
      "apply_mode": "not-affected",
      "backport_candidate": false,
      "branch_commit": null,
      "branch_patch": null,
      "full_suite": "not-run",
      "notes": "baseline branch compiler does not match the recorded reproducer signature",
      "reproduces": false,
      "targeted_tests": "not-run"
    }
  },
  "bugzilla": {
    "id": 123949,
    "keywords": [
      "needs-bisection",
      "needs-reduction"
    ],
    "refreshed_at": "2026-03-28T12:57:16Z",
    "resolution": "FIXED",
    "status": "RESOLVED",
    "summary": "[16 regression] [PDT] ice in gfc_match_decl_type_spec, at fortran/decl.cc:4782",
    "url": "https://gcc.gnu.org/bugzilla/show_bug.cgi?id=123949"
  },
  "classification": {
    "regression": true,
    "severity": "ice-on-valid",
    "validity_class": "valid-code"
  },
  "fix_status": "merged",
  "github_issue": 49,
  "notes": "",
  "pr": 123949,
  "submission_status": {
    "on_bugzilla": false,
    "on_mailing_list": false,
    "sent": false
  },
  "title": "[16 regression] [PDT] ICE in `gfc_match_decl_type_spec` at `decl.cc:4782`",
  "trunk": {
    "branch": "origin/pr123949-init-se-fix",
    "commit": "05159b27621",
    "patch": "0001-fortran-Initialize-gfc_se-in-PDT-component-allocatio.patch"
  },
  "updated_at": "2026-03-28T16:27:43Z",
  "validation": {
    "baseline": {
      "contains_any": [
        "internal compiler error",
        "ICE in"
      ],
      "exit": "nonzero",
      "not_contains": []
    },
    "compile": [
      "gcc-build/gcc/gfortran",
      "-B",
      "gcc-build/gcc",
      "-c",
      "-w",
      "pr/123949/reproducer.f90",
      "-o",
      "/dev/null"
    ],
    "env": {},
    "fixed": {
      "contains_any": [],
      "exit": "zero",
      "not_contains": [
        "internal compiler error"
      ]
    },
    "kind": "compile",
    "run": []
  }
}
