{
  "artifacts": {
    "bugzilla_comment": "submission/bugzilla-comment.txt",
    "mailing_list_cover": "submission/mailing-list-cover.txt",
    "maintainer_summary": "submission/maintainer-summary.md"
  },
  "backports": {
    "gcc-13": {
      "apply_mode": "unknown",
      "backport_candidate": null,
      "branch_commit": null,
      "branch_patch": null,
      "full_suite": "not-run",
      "notes": "",
      "reproduces": null,
      "targeted_tests": "not-run"
    },
    "gcc-14": {
      "apply_mode": "unknown",
      "backport_candidate": null,
      "branch_commit": null,
      "branch_patch": null,
      "full_suite": "not-run",
      "notes": "",
      "reproduces": null,
      "targeted_tests": "not-run"
    },
    "gcc-15": {
      "apply_mode": "unknown",
      "backport_candidate": null,
      "branch_commit": null,
      "branch_patch": null,
      "full_suite": "not-run",
      "notes": "",
      "reproduces": null,
      "targeted_tests": "not-run"
    }
  },
  "bugzilla": {
    "id": 94978,
    "keywords": [
      "diagnostic"
    ],
    "refreshed_at": "2026-04-14T07:53:01Z",
    "resolution": "",
    "status": "NEW",
    "summary": "[13/14/15 Regression] Bogus warning \"Array reference at (1) out of bounds in loop beginning at (2)\"",
    "url": "https://gcc.gnu.org/bugzilla/show_bug.cgi?id=94978"
  },
  "classification": {
    "regression": true,
    "severity": "diagnostic",
    "validity_class": "valid-code"
  },
  "fix_status": "merged",
  "github_issue": 66,
  "notes": "",
  "pr": 94978,
  "submission_status": {
    "on_bugzilla": true,
    "on_mailing_list": false,
    "sent": false
  },
  "title": "bogus do-subscript warning",
  "trunk": {
    "branch": null,
    "commit": "790671b708400d1fc6bb1abbf1601f3616e8220d",
    "patch": "0001-fortran-Avoid-bogus-do-subscript-warnings-in-skipped.patch"
  },
  "updated_at": "2026-04-14T07:53:01Z",
  "validation": {
    "baseline": {
      "contains_any": [
        "internal compiler error",
        "ICE in"
      ],
      "exit": "nonzero",
      "not_contains": []
    },
    "compile": [
      "gcc-build/gcc/gfortran",
      "-B",
      "gcc-build/gcc",
      "-c",
      "pr/94978/reproducer.f90",
      "-o",
      "/dev/null"
    ],
    "env": {},
    "fixed": {
      "contains_any": [],
      "exit": "zero",
      "not_contains": [
        "internal compiler error"
      ]
    },
    "kind": "compile",
    "run": []
  }
}
