{
  "artifacts": {
    "bugzilla_comment": "submission/bugzilla-comment.txt",
    "mailing_list_cover": "submission/mailing-list-cover.txt",
    "maintainer_summary": "submission/maintainer-summary.md"
  },
  "backports": {
    "gcc-13": {
      "apply_mode": "unknown",
      "backport_candidate": null,
      "branch_commit": null,
      "branch_patch": null,
      "full_suite": "not-run",
      "notes": "",
      "reproduces": null,
      "targeted_tests": "not-run"
    },
    "gcc-14": {
      "apply_mode": "unknown",
      "backport_candidate": null,
      "branch_commit": null,
      "branch_patch": null,
      "full_suite": "not-run",
      "notes": "",
      "reproduces": null,
      "targeted_tests": "not-run"
    },
    "gcc-15": {
      "apply_mode": "unknown",
      "backport_candidate": null,
      "branch_commit": null,
      "branch_patch": null,
      "full_suite": "not-run",
      "notes": "",
      "reproduces": null,
      "targeted_tests": "not-run"
    }
  },
  "bugzilla": {
    "id": 124586,
    "keywords": [
      "build"
    ],
    "refreshed_at": "2026-03-28T12:57:21Z",
    "resolution": "",
    "status": "UNCONFIRMED",
    "summary": "aarch64-netbsd native build misses driver-aarch64.o for host_detect_local_cpu",
    "url": "https://gcc.gnu.org/bugzilla/show_bug.cgi?id=124586"
  },
  "classification": {
    "regression": false,
    "severity": "other",
    "validity_class": "valid-code"
  },
  "fix_status": "patch-ready",
  "github_issue": 109,
  "notes": "",
  "pr": 124586,
  "submission_status": {
    "on_bugzilla": true,
    "on_mailing_list": false,
    "sent": false
  },
  "title": "aarch64-netbsd native build misses driver-aarch64.o for host_detect_local_cpu",
  "trunk": {
    "branch": null,
    "commit": null,
    "patch": "0001-aarch64-Add-aarch64-netbsd-to-host_detect_local_cpu.patch"
  },
  "updated_at": "2026-03-28T14:09:57Z",
  "validation": {
    "baseline": {
      "contains_any": [
        "internal compiler error",
        "ICE in"
      ],
      "exit": "nonzero",
      "not_contains": []
    },
    "compile": [
      "gcc-build/gcc/gfortran",
      "-B",
      "gcc-build/gcc",
      "-c",
      "pr/124586/reproducer.f90",
      "-o",
      "/dev/null"
    ],
    "env": {},
    "fixed": {
      "contains_any": [],
      "exit": "zero",
      "not_contains": [
        "internal compiler error"
      ]
    },
    "kind": "compile",
    "run": []
  }
}
