{
  "artifacts": {
    "bugzilla_comment": "submission/bugzilla-comment.txt",
    "mailing_list_cover": "submission/mailing-list-cover.txt",
    "maintainer_summary": "submission/maintainer-summary.md"
  },
  "backports": {
    "gcc-13": {
      "apply_mode": "unknown",
      "backport_candidate": null,
      "branch_commit": null,
      "branch_patch": null,
      "full_suite": "not-run",
      "notes": "",
      "reproduces": null,
      "targeted_tests": "not-run"
    },
    "gcc-14": {
      "apply_mode": "unknown",
      "backport_candidate": null,
      "branch_commit": null,
      "branch_patch": null,
      "full_suite": "not-run",
      "notes": "",
      "reproduces": null,
      "targeted_tests": "not-run"
    },
    "gcc-15": {
      "apply_mode": "unknown",
      "backport_candidate": null,
      "branch_commit": null,
      "branch_patch": null,
      "full_suite": "not-run",
      "notes": "",
      "reproduces": null,
      "targeted_tests": "not-run"
    }
  },
  "bugzilla": {
    "id": 123868,
    "url": "https://gcc.gnu.org/bugzilla/show_bug.cgi?id=123868"
  },
  "classification": {
    "regression": true,
    "severity": "wrong-code",
    "validity_class": "valid-code"
  },
  "fix_status": "merged",
  "github_issue": 47,
  "notes": "",
  "pr": 123868,
  "submission_status": {
    "on_bugzilla": false,
    "on_mailing_list": false,
    "sent": false
  },
  "title": "Memory leak on assignment with nested allocatable components",
  "trunk": {
    "branch": null,
    "commit": "ca448bc5e435",
    "patch": "0001-fortran-Fix-memory-leak-on-assignment-with-nested-al.patch"
  },
  "updated_at": "2026-03-11T19:41:19Z",
  "validation": {
    "compile": [
      "gcc-build/gcc/gfortran",
      "-B",
      "gcc-build/gcc",
      "-c",
      "pr/123868/reproducer.f90",
      "-o",
      "/dev/null"
    ],
    "env": {},
    "kind": "compile",
    "run": []
  }
}
