{
  "artifacts": {
    "bugzilla_comment": "submission/bugzilla-comment.txt",
    "mailing_list_cover": "submission/mailing-list-cover.txt",
    "maintainer_summary": "submission/maintainer-summary.md"
  },
  "backports": {
    "gcc-13": {
      "apply_mode": "unknown",
      "backport_candidate": null,
      "branch_commit": null,
      "branch_patch": null,
      "full_suite": "not-run",
      "notes": "",
      "reproduces": null,
      "targeted_tests": "not-run"
    },
    "gcc-14": {
      "apply_mode": "unknown",
      "backport_candidate": null,
      "branch_commit": null,
      "branch_patch": null,
      "full_suite": "not-run",
      "notes": "",
      "reproduces": null,
      "targeted_tests": "not-run"
    },
    "gcc-15": {
      "apply_mode": "unknown",
      "backport_candidate": null,
      "branch_commit": null,
      "branch_patch": null,
      "full_suite": "not-run",
      "notes": "",
      "reproduces": null,
      "targeted_tests": "not-run"
    }
  },
  "bugzilla": {
    "id": 120723,
    "keywords": [
      "ice-on-valid-code",
      "openacc"
    ],
    "refreshed_at": "2026-03-28T12:56:57Z",
    "resolution": "",
    "status": "NEW",
    "summary": "[13/14/15/16 Regression][OpenACC] '!$acc ... attach(scalar)' \u2013 ICE 'unexpected pointer mapping node'",
    "url": "https://gcc.gnu.org/bugzilla/show_bug.cgi?id=120723"
  },
  "classification": {
    "regression": true,
    "severity": "ice-on-valid",
    "validity_class": "valid-code"
  },
  "fix_status": "merged",
  "github_issue": 96,
  "notes": "",
  "pr": 120723,
  "submission_status": {
    "on_bugzilla": false,
    "on_mailing_list": false,
    "sent": false
  },
  "title": "OpenACC scalar `attach`/`detach` ICE",
  "trunk": {
    "branch": "origin/pr120723-fix",
    "commit": "0af9613810ecdc991633f58f5dd81a574aa2af31",
    "patch": "0001-fortran-Fix-scalar-OpenACC-attach-detach-lowering-PR.patch"
  },
  "updated_at": "2026-03-28T16:27:43Z",
  "validation": {
    "baseline": {
      "contains_any": [
        "internal compiler error",
        "ICE in"
      ],
      "exit": "nonzero",
      "not_contains": []
    },
    "compile": [
      "gcc-build/gcc/gfortran",
      "-B",
      "gcc-build/gcc",
      "-c",
      "pr/120723/reproducer.f90",
      "-o",
      "/dev/null"
    ],
    "env": {},
    "fixed": {
      "contains_any": [],
      "exit": "zero",
      "not_contains": [
        "internal compiler error"
      ]
    },
    "kind": "compile",
    "run": []
  }
}
