{
  "artifacts": {
    "bugzilla_comment": "submission/bugzilla-comment.txt",
    "mailing_list_cover": "submission/mailing-list-cover.txt",
    "maintainer_summary": "submission/maintainer-summary.md"
  },
  "backports": {
    "gcc-13": {
      "apply_mode": "unknown",
      "backport_candidate": null,
      "branch_commit": null,
      "branch_patch": null,
      "full_suite": "not-run",
      "notes": "",
      "reproduces": null,
      "targeted_tests": "not-run"
    },
    "gcc-14": {
      "apply_mode": "unknown",
      "backport_candidate": null,
      "branch_commit": null,
      "branch_patch": null,
      "full_suite": "not-run",
      "notes": "",
      "reproduces": null,
      "targeted_tests": "not-run"
    },
    "gcc-15": {
      "apply_mode": "unknown",
      "backport_candidate": null,
      "branch_commit": null,
      "branch_patch": null,
      "full_suite": "not-run",
      "notes": "",
      "reproduces": null,
      "targeted_tests": "not-run"
    }
  },
  "bugzilla": {
    "id": 121475,
    "keywords": [],
    "last_change_time": "2026-01-08T00:15:04Z",
    "last_synced_utc": "2026-06-19T12:42:15Z",
    "refreshed_at": "2026-06-19T12:42:15Z",
    "resolution": "FIXED",
    "status": "RESOLVED",
    "summary": "Missed finalization",
    "url": "https://gcc.gnu.org/bugzilla/show_bug.cgi?id=121475"
  },
  "classification": {
    "regression": false,
    "severity": "other",
    "validity_class": "valid-code"
  },
  "fix_status": "merged",
  "github_issue": 8,
  "notes": "",
  "pr": 121475,
  "submission_status": {
    "on_bugzilla": false,
    "on_mailing_list": false,
    "sent": false
  },
  "title": "Missed finalization",
  "trunk": {
    "branch": null,
    "commit": "a30b5f23b58b236207e59635cf7e9504c603f376",
    "patch": "0001-fortran-Finalize-function-result-in-defined-assignme.patch"
  },
  "updated_at": "2026-06-19T12:42:15Z",
  "validation": {
    "baseline": {
      "contains_any": [
        "internal compiler error",
        "ICE in"
      ],
      "exit": "nonzero",
      "not_contains": []
    },
    "compile": [
      "gcc-build/gcc/gfortran",
      "-B",
      "gcc-build/gcc",
      "-c",
      "pr/121475/reproducer.f90",
      "-o",
      "/dev/null"
    ],
    "env": {},
    "fixed": {
      "contains_any": [],
      "exit": "zero",
      "not_contains": [
        "internal compiler error"
      ]
    },
    "kind": "compile",
    "run": []
  }
}
