{
  "artifacts": {
    "bugzilla_comment": "submission/bugzilla-comment.txt",
    "mailing_list_cover": "submission/mailing-list-cover.txt",
    "maintainer_summary": "submission/maintainer-summary.md"
  },
  "backports": {
    "gcc-13": {
      "apply_mode": "unknown",
      "backport_candidate": null,
      "branch_commit": null,
      "branch_patch": null,
      "full_suite": "not-run",
      "notes": "",
      "reproduces": null,
      "targeted_tests": "not-run"
    },
    "gcc-14": {
      "apply_mode": "unknown",
      "backport_candidate": null,
      "branch_commit": null,
      "branch_patch": null,
      "full_suite": "not-run",
      "notes": "",
      "reproduces": null,
      "targeted_tests": "not-run"
    },
    "gcc-15": {
      "apply_mode": "unknown",
      "backport_candidate": null,
      "branch_commit": null,
      "branch_patch": null,
      "full_suite": "not-run",
      "notes": "",
      "reproduces": null,
      "targeted_tests": "not-run"
    }
  },
  "bugzilla": {
    "id": 110626,
    "keywords": [
      "wrong-code"
    ],
    "last_change_time": "2026-04-22T14:32:55Z",
    "last_synced_utc": "2026-05-27T18:13:40Z",
    "refreshed_at": "2026-05-27T18:13:40Z",
    "resolution": "",
    "status": "NEW",
    "summary": "[13/14/15/16/17 regression] Duplicated finalization in derived",
    "url": "https://gcc.gnu.org/bugzilla/show_bug.cgi?id=110626"
  },
  "classification": {
    "regression": true,
    "severity": "wrong-code",
    "validity_class": "valid-code"
  },
  "fix_status": "open",
  "github_issue": 92,
  "notes": "",
  "pr": 110626,
  "submission_status": {
    "on_bugzilla": false,
    "on_mailing_list": false,
    "sent": false
  },
  "title": "duplicated finalization in derived assignment",
  "trunk": {
    "branch": null,
    "commit": null,
    "patch": null
  },
  "updated_at": "2026-05-27T18:13:52Z",
  "validation": {
    "baseline": {
      "contains_any": [
        "internal compiler error",
        "ICE in"
      ],
      "exit": "nonzero",
      "not_contains": []
    },
    "compile": [
      "gcc-build/gcc/gfortran",
      "-B",
      "gcc-build/gcc",
      "-c",
      "pr/110626/reproducer.f90",
      "-o",
      "/dev/null"
    ],
    "env": {},
    "fixed": {
      "contains_any": [],
      "exit": "zero",
      "not_contains": [
        "internal compiler error"
      ]
    },
    "kind": "compile",
    "run": []
  }
}
